Index,Keyword,Tweets

0,zed,zed 's Likee

1,zed,Feelings ... nothing FEELINGS

2,zed,Hey 's almost six months still heard anything friend Dafe We refuse loose hope Ple

3,zed,The gloves Biff Bam Pow

4,zed,We listened feedback made *a lot* improvements iOS app past year We committed keeping

5,zed,congratulations officially gay

6,zed,Thas spirit.tired listening average ohnz name supporting zed

7,zed,kpop stan kebab stan

8,zed,This one fav videos I bring back timeline LMAOOO

9,zed,... There much entertainment enough time This simultaneously best worst timeline

10,zed,See erh Ghana police dey disgrace oh ... friend came France enjoy Ghana ... see yawa tins ... Every

11,zed,Most trending video right 2012-12-21

12,zed,Fake

13,zed,What wawu ... The sweetest karma

14,zed,Bloodmoon Zed

15,zed,Boy depressing see people lamenting wait `` delayed '' chapter releases current biggest Shon

16,zed,This nonesense security beating people came show country rampant someone pays come watch yo

17,zed,Hameeeet

18,zed,Hoes keep tryin

19,zed,I need head right cuz Melania right

20,zed,Literally barakah haram money The quicker earn quicker lose

21,zed,Bot alert

22,zed,Final st semi defeat -58 '20 Andre Curbello commit led

23,zed,That life exhausting time hobbies passed horrib

24,zed,I searched form land For years years I roamed I gazed gazeless stare We walked million hills I must

25,zed,A new ZED born Meet ZED powerful stereo camera market New full metal case unrivaled field-of

26,zed,iS tHaT ShOrT jOkE

27,zed,know right HAHAHA

28,zed,Teamwork constructs clever solutions today especially ... More Capricorn

29,zed,Zed Nelson captures debilitating effects gentrification Hackney via

30,zed,You may wish read please

31,zed,el zed support carreando

32,zed,Stop fucking appearing tl nigga

33,zed,dying laughter together

34,zed,Keep giving us zed dada

35,zed,This first time I seen blue Apple imma Retweet good luck

36,zed,See erh Ghana police dey disgrace oh ... friend came France enjoy Ghana ... see yawa tins ... Every

37,zed,need get lid fascist hate spewing network examp

38,zed,Bein broke mindstate If think money material things make rich lost

39,zed,I 've yet see bad word series

40,zed,When government take seriously Music even seen career respectable job Can imagine

41,zed,You know

42,zed,A new ZED born Meet ZED powerful stereo camera market New full metal case unrivaled field-of

43,zed,I liked Jimmy Olsen I fell behind life getting many books I dropped I su

44,zed,What attacks right That ok I suppose

45,zed,I able post next decade I rn

46,zed,Shots non Zambians pa zed vinabwela mochedwa

47,zed,Dont come disturb peace war demons

48,zed,I Tory MP gets abuse I particularly rig

49,zed,Just 're inlove n't mean 're right

50,zed,weak ass zed smd

51,zed,Oh

52,zed,Jurgen Klopp thinks Liverpool fans celebrate like crazy crowned FIFA World Club Cup champions later

53,zed,I made mistake passing Jimmy Olsen title wait trade I 'm dying tra

54,zed,Because IT IS-

55,zed,When take boda stage

56,zed,I sure great I need break Batman Maybe trades I

57,zed,Ikr ... glad I realising evil bad guy kills hundreds people also

58,zed,KAMPALA WE OUTCHEA ITS LIT

59,zed,I 'm looking forward new creative team new direction They promised horror elements

60,zed,Got neat little bust Micheal Burnham Star Trek Discovery Maybe I binge-watch first season b

61,zed,This kind dumb

62,zed,HELLO Desperate x3 tickets A Christmas Carol tomorrow Family thought 'd booked But ha

63,zed,... please wait get pass least n't pay ...

64,zed,See erh Ghana police dey disgrace oh ... friend came France enjoy Ghana ... see yawa tins ... Every

65,zed,The pretty boy hero macho man cinnamon roll

66,zed,Billionaire things

67,zed,Got nice hardcover Watchmen odds ends Gon na give good skim upcoming vacation Looks

68,zed,I leave Zed Dio

69,zed,I 'll admit I guilty hitting TV twice playing Wii Sports

70,zed,Pedicure glass champagne two ... *Burp*

71,zed,Batman made cut trades At least Tom King run Might take break Bat awhile

72,zed,Follow RT chance winning today Christmas Bundle 2 Players Ends rd T amp C

73,zed,On another note I live streets away woodison I 've heard war sirens intro zed cars Fucking hell DoGz Of w4R lol

74,zed,Legion Super-Heroes made cut So couple come week last week An

75,zed,Ancelotti first improvement charge needs scrapping Zed cars shite The people club What people

76,zed,Any event level maxiseries I wait trade made cut well Doomsday Clock ended Strang

77,zed,I get Aquaman fix every month It leaving pull EVER

78,zed,We weird belief Zed advisor someone agrees It actually good g

79,zed,Glad hear bro

80,zed,Always

81,zed,Anything put made cut Much like I everything released flop

82,zed,U good

83,zed,See erh Ghana police dey disgrace oh ... friend came France enjoy Ghana ... see yawa tins ... Every

84,zed,I also feel like I order collect every floppy include line Case point curren

85,zed,See erh Ghana police dey disgrace oh ... friend came France enjoy Ghana ... see yawa tins ... Every

86,zed,thanks mate

87,zed,Aghhh gim RN

88,zed,DC Dollar Comics reprint line makes cut I keep bags boards I read flip th

89,zed,You two greasy tune would pure energy

90,zed,Zed

91,zed,Thanks buddy

92,zed,Ik said features album think french brudda Niska

93,zed,I feel like Kim Kourtney really need take problems streets square It 's time

94,zed,Savage Dragon makes cut A satisfying read single issue every time Erik Larsen want

95,zed,I bet owner tried years share one ever replied emails ...

96,zed,U want baddddd eni

97,zed,See erh Ghana police dey disgrace oh ... friend came France enjoy Ghana ... see yawa tins ... Every

98,zed,Loved Folklords The story art ace continuing read mini floppies Read like

99,zed,He favorite The fact everyone hates makes endearing I mean people stupi

100,zed,Ahh sorry hear mate really hope nice Xmas anyway

101,zed,It awhile yeah still getting comics whole lot less Haven given floppies

102,zed,Both enjoyed immensely

103,zed,whh w e kk ijssss ed nghh h hheld hwands

104,zed,Or

105,zed,Muppets even Spoiler I still annoyed Jar Jar Binks show

106,zed,Everytime say zii instead zed

107,zed,Loool cmon

108,zed,Your avi fire af

109,zed,Nothing happened far would made slightest diffe

110,zed,Plesse zed teach

111,zed,I feel pain ... 2nd xmas without mum Dont cat loose though ca n't share pain

112,zed,Yeah 's democracy works Forcing people silence Not

113,zed,Everytime say zii instead zed

114,zed,chaeyoung 'm good rapping 3 nayeon AAAAAA YOU 'RE SO CUTE

115,zed,soft hard pic ult challenge

116,zed,Everytime say zii instead zed

117,zed,I blame allowing country progress succee

118,zed,Turn sound I promise wo n't regret

119,zed,I like chocolato I never eat kit kat

120,zed,Speak strength existence words spells

121,zed,Pa Zed allow year semester

122,zed,Champs mais imorais lol Zed Diana e Zoe

123,zed,Introducing new manager Everton Football Club

124,zed,See erh Ghana police dey disgrace oh ... friend came France enjoy Ghana ... see yawa tins ... Every

125,zed,I 'm pretty much sure 's people play champion mains though ba

126,zed,A new ZED born Meet ZED powerful stereo camera market New full metal case unrivaled field-of

127,zed,Of friends Anita take pics Zed twitter loves bring negativity anything Keep obsess

128,zed,I read like start stormzy handsome hardddd

129,zed,Energy

130,zed,Today You n't like helped

131,zed,People saying Jhin might lose arm end Zed comic wearing gold

132,zed,And got You know I right

133,zed,Zed football back weekend

134,zed,See erh Ghana police dey disgrace oh ... friend came France enjoy Ghana ... see yawa tins ... Every

135,zed,See erh Ghana police dey disgrace oh ... friend came France enjoy Ghana ... see yawa tins ... Every

136,zed,You people ca n't let things without turning something provocative huh Zed Twitter forever mess

137,zed,I think whole movie filmed puppets

138,zed,Of friends Anita take pics Zed twitter loves bring negativity anything Keep obsess

139,zed,ZED vs FIORA TOP DEFEAT games M mastery points KDA /1/3 Korea Diamond v9.24

140,zed,See erh Ghana police dey disgrace oh ... friend came France enjoy Ghana ... see yawa tins ... Every

141,zed,In distance hear Zed Toqger singing `` Twinkle Twinkle little star '' seing helmets

142,zed,Thank youuu

143,zed,Now Playing D M M Feat Thev Music Eeriment Listen live

144,zed,I 'm taking media interviews stage

145,zed,Girl I literally wept I WEPT

146,zed,See erh Ghana police dey disgrace oh ... friend came France enjoy Ghana ... see yawa tins ... Every

147,zed,See erh Ghana police dey disgrace oh ... friend came France enjoy Ghana ... see yawa tins ... Every

148,zed,You 're years late making Wii-proof TV

149,zed,You know ZED industry small see number twitter followers S. A AKA million Cassper Nyoves

150,zed,Liked YouTube ZED amp NED 'S DECLASSIFIED Life Advice w/ Devon Werkheiser

151,zed,Do n't blame us failures

152,zed,Zed gifted glorious exercise machine~ I yet try looks magnificent~ I eected nothing less robot~

153,zed,Once deliberately dense smart think

154,zed,Please recommend Harry Potter refugees anything actually good treasure

155,zed,I swear

156,zed,But posted So come post

157,zed,Zed map..

158,zed,But posted So come post

159,zed,Does yazuka exist canadian steam shop

160,zed,See erh Ghana police dey disgrace oh ... friend came France enjoy Ghana ... see yawa tins ... Every

161,zed,See erh Ghana police dey disgrace oh ... friend came France enjoy Ghana ... see yawa tins ... Every

162,zed,We need zed version

163,zed,See erh Ghana police dey disgrace oh ... friend came France enjoy Ghana ... see yawa tins ... Every

164,zed,agree stomach

165,zed,Kyah zed stay classy

166,zed,comeback kpop needs

167,zed,girl told likes pulling hair go makes feel like remy ratatouille i-

168,zed,See erh Ghana police dey disgrace oh ... friend came France enjoy Ghana ... see yawa tins ... Every

169,zed,Contrast abuse Boris et al get seems entirely

170,zed,See erh Ghana police dey disgrace oh ... friend came France enjoy Ghana ... see yawa tins ... Every

171,zed,Thanks Gav Did folks enjoy

172,zed,No Don deliberately dense It abusive/harmful targeted harassment

173,zed,Why Because people different opinion

174,zed,This interesting book great Pan-Africanist historian amp intellectual Hakim Adi `` Black British History New

175,zed,See erh Ghana police dey disgrace oh ... friend came France enjoy Ghana ... see yawa tins ... Every

176,zed,This interesting book great Pan-Africanist historian amp intellectual Hakim Adi `` Black British History New

177,zed,That thing When people different opinion I bet think ar

178,zed,Of friends Anita take pics Zed twitter loves bring negativity anything Keep obsess

179,zed,Zed lang ser

180,zed,See erh Ghana police dey disgrace oh ... friend came France enjoy Ghana ... see yawa tins ... Every

181,zed,made attention directed path shadow left It already rea

182,zed,One zed never failed us

183,zed,Of friends Anita take pics Zed twitter loves bring negativity anything Keep

184,zed,See erh Ghana police dey disgrace oh ... friend came France enjoy Ghana ... see yawa tins ... Every

185,zed,hopefully next year

186,zed,One performer cast thousands Excellent atmospheric performance

187,zed,Thanks Andy We 're delighted enjoyed Thank support

188,zed,Thanks Gavin So great audience

189,zed,An exceptional performance A Christmas Carol A treat watch enjoy

190,zed,one said one wants shirt TEAM TREVOR want hoodies tessa hardin trevor zed

191,zed,See erh Ghana police dey disgrace oh ... friend came France enjoy Ghana ... see yawa tins ... Every

192,zed,Next year

193,zed,See erh Ghana police dey disgrace oh ... friend came France enjoy Ghana ... see yawa tins ... Every

194,zed,one said one wants shirt TEAM TREVOR want hoodies tessa hardin trevor zed

195,zed,See erh Ghana police dey disgrace oh ... friend came France enjoy Ghana ... see yawa tins ... Every

196,zed,God

197,zed,See erh Ghana police dey disgrace oh ... friend came France enjoy Ghana ... see yawa tins ... Every

198,zed,The scene Geraldine Chaplin medium terrified first time I watched

199,zed,See erh Ghana police dey disgrace oh ... friend came France enjoy Ghana ... see yawa tins ... Every

