Index,Keyword,Tweets
0,Yasuo,Im -0 in series and this guy locks in Yasuo support lol.
1,Yasuo,When the Yasuo knock up doesn’t get the kill but Q is off cool down
2,Yasuo,friendly yasuo proceeds to flame me for losing my lane in sub-par conditions. Oh did I mention I was faci…
3,Yasuo,I hate Yasuo players.
4,Yasuo,Stoned Gold Elo Yasuo Main Fin/Eng Come and chat with me. Last stream before New Year
5,Yasuo,Once nasus gets stacks like and follow for more league stuff ️️️. …
6,Yasuo,Once nasus gets stacks like and follow for more league stuff ️️️. …
7,Yasuo,Shout outs to /12/2 yasuo though that's like almost there
8,Yasuo,/34/12 has been the combined score of my teams yasuo my last couple games... Idk why I don't just Dodge when people pick him
9,Yasuo,"no, it's just silver yasuo"
10,Yasuo,: Yasuo resting on a rock and enjoying the view! Another push to refine my style. …
11,Yasuo,: Yasuo resting on a rock and enjoying the view! Another push to refine my style. …
12,Yasuo,LET ME YASUO FFS
13,Yasuo,"Just saw a Yasuo dish out tornado's, like it was the next weather report, with no Cooldown reduction whatsoever, go…"
14,Yasuo,I don’t even know what this filter is but it’s giving me True Damage Yasuo vibes.
15,Yasuo,He has bark. But it tastes like one. Yasuo can try anytime.
16,Yasuo,— Perhaps I can help. Papa Yasuo and momma Syndra.
17,Yasuo,True damage Yasuo! The last skin I need to complete the Yasuo collection
18,Yasuo,TRUE DAMAGE // Watch Me Tags: la Summoner's…
19,Yasuo,: Yasuo resting on a rock and enjoying the view! Another push to refine my style. …
20,Yasuo,: That Yasuo statue tho..
21,Yasuo,: Yasuo resting on a rock and enjoying the view! Another push to refine my style. …
22,Yasuo,"Braum, Yasuo headline list of League champions that players AFK on ： Dot Esports"
23,Yasuo,: Yasuo resting on a rock and enjoying the view! Another push to refine my style. …
24,Yasuo,: Yasuo resting on a rock and enjoying the view! Another push to refine my style. …
25,Yasuo,On god bro please give me yasuo rolls
26,Yasuo,Yasuo resting on a rock and enjoying the view! Another push to refine my style. …
27,Yasuo,: just play morde and yasuo and league will be fun it's simple
28,Yasuo,just play morde and yasuo and league will be fun it's simple
29,Yasuo,: HAPPY HOLIGAYS!!! 🤗️
30,Yasuo,"He’s also the voice actor for league of legends champion yasuo, also in bleach, Afro samurai, also he’…"
31,Yasuo,Yasuo is of course on the list. 🤣
32,Yasuo,First time playing Kled today and my Yasuo just got a penta!
33,Yasuo,"He's so chill. If I need to go aggressive, there's always Yasuo"
34,Yasuo,The minute grind fest... all for our Yasuo to do Elder while Ori was backdooring our nexus....
35,Yasuo,"Lmao giving me BM item so I can replace Yasuo for Light. This patch is so weird, I have no idea what's happening…"
36,Yasuo,Lmao went /3 with Yasuo this morning. I’m a god honestly.
37,Yasuo,Graves Sett Xin zhao
38,Yasuo,: Cuteness..
39,Yasuo,Uma Jan's Yasuo in the Worlds semis against SKT
40,Yasuo,We should play some league sometime! I'm one of the millions of Yasuo one tricks
41,Yasuo,"I do love League, I do loathe Yasuo. You can’t change my mind, that character has about too many tools in his kit."
42,Yasuo,Playing Jhin mid into Yasuo.
43,Yasuo,Yasuo BS Fix this please? via
44,Yasuo,"Lol bro we get it, you hate Heimer but like Yasuo players. It’s okay cancer is cancer"
45,Yasuo,Kindred
46,Yasuo,: when they ban yasuo but i run it down on akali anyways
47,Yasuo,"Ah Yasuo, a person of culture I see"
48,Yasuo,: when they ban yasuo but i run it down on akali anyways
49,Yasuo,nightbringer yasuo
50,Yasuo,"you put caitlyn, yasuo, and fucking mages above them..."
51,Yasuo,: when they ban yasuo but i run it down on akali anyways
52,Yasuo,: when they ban yasuo but i run it down on akali anyways
53,Yasuo,: Playing Senna support with 's Yasuo ADC. We're doomed
54,Yasuo,my yasuo has million mastery god spare me
55,Yasuo,Playing Senna support with 's Yasuo ADC. We're doomed
56,Yasuo,: when they ban yasuo but i run it down on akali anyways
57,Yasuo,: when they ban yasuo but i run it down on akali anyways
58,Yasuo,yasuo zed rengar down tiers gp lb down tier and this is perfect
59,Yasuo,"Aaah, if only Yasuo had a windwall... :')"
60,Yasuo,: Made a map cover for one of the best Yasuo players in NA -- make sure to follow and subscribe to his Twitch str…
61,Yasuo,"My peak? Maybe, probably (with the useless windwall and all) - still loved the play tho …"
62,Yasuo,: when they ban yasuo but i run it down on akali anyways
63,Yasuo,when they ban yasuo but i run it down on akali anyways
64,Yasuo,: Made a map cover for one of the best Yasuo players in NA -- make sure to follow and subscribe to his Twitch str…
65,Yasuo,Thinking abt how much I hate Yasuo and Fizz...
66,Yasuo,Made a map cover for one of the best Yasuo players in NA -- make sure to follow and subscribe to his Tw…
67,Yasuo,"My week on Twitter : Mentions, Likes, Retweets, 9K Retweet Reach, New Followers. See yours with…"
68,Yasuo,Aphelios knowing that just his ult gives a penta
69,Yasuo,: SURPRISE! I'm the official Akali cosplayer for . I partnered with them to bring her to life.…
70,Yasuo,Broke into the top Yasuo Players/Caitlyns in NA
71,Yasuo,Ok but what if I dress like yasuo would you tell me the secrets then?
72,Yasuo,This post was made by the /16/4 Yasuo
73,Yasuo,nibba did u just put yasuo in highest skill cap... i play that champ with my pants to my ankles and finger up my entire rectum
74,Yasuo,kaze best yasuo ph indeed
75,Yasuo,"They said kassadin was a counter, I'm only silver but in years I have never been wrecked like that. It'…"
76,Yasuo,For a second i was imagining what someone get if they are on Satan's naughty list
77,Yasuo,Welcome to youtube... Oh wait this is twitter
78,Yasuo,"Our biggest fans this week: ezrealblindado, AngelNya2, Wubba_Ricky. Thank you! via"
79,Yasuo,Prints on steel by
80,Yasuo,Yasuo x Riven is where it’s at Can’t tell me that this isnt the cute thing ever
81,Yasuo,"I dont think yasuo top is bad atm but no way hes the same tier as camille or riven, id put him b tier"
82,Yasuo,"""Stay under tower"" Yeah because that totally worked out for yasuo and alistar"
83,Yasuo,/3 DBlade &gt; PD? Any game yasuo doesnt get shut down he has insane cs because of fa…
84,Yasuo,"Had a lot of fun tonight with the ""Big Chillin and League"" Stream. Dominated with Cait as Usual. I need some time a…"
85,Yasuo,Fix top lane and get akali out of our lane bring her back mid and buff champs like wukong and…
86,Yasuo,""" Those vicious drugs only serve to slowly destroy your body, Yasuo. """
87,Yasuo,"riddim girl, sharigan, and yasuo don’t me the most impactful songs of the decade"
88,Yasuo,what are the yasuo top builds rn? feel like I get dunked if they pick bruisers
89,Yasuo,: I was considering not playing TCS. and hit me up last minute and convinced me to play. It is an honor…
90,Yasuo,"Do you think streaming will help, seems like the trolls will be out in force if you make a big deal a…"
91,Yasuo,: barron - guap bloodthinnerz - limbo the others x emalkay - fallout barron x london nebel - stand you’re ground…
92,Yasuo,: Giving away k RP before I leave for winter break. All you need to do is RT to enter. I will randomly pick people t…
93,Yasuo,days already!!! Like n retweet plz
94,Yasuo,For every like is a day I will not use twitter
95,Yasuo,Anyone that's played League before will find it funny that the English voice of Gill was done by the same guy that did Yasuo lmao
96,Yasuo,BENZMIXER R28D Marauda Deathpit Spag Zoom Leotrix Hive Bounce Crowell x Bommer Yasuo Griztronics Eptic Power
97,Yasuo,barron - guap bloodthinnerz - limbo the others x emalkay - fallout barron x london nebel - stand you’…
98,Yasuo,ᴼᵒᶜ:// Yasuo is on a mission to be annoying today. I guess it's to mask how lonely he can…
99,Yasuo,"Tested Ashe. Working perfectly. Don't have time to test Yasuo right this second, but should work."
100,Yasuo,Every Yasuo player
101,Yasuo,Anybody wanna donate me some land so I can have more horses
102,Yasuo,Spaceship remix Bad man sound Fabrication-emelkay I can’t stop…
103,Yasuo,"playing yasuo, irelia, qiyana, gragas(mid) and lee sin when jungle"
104,Yasuo,: happy monday friendz I hope everyone has a great week except for yasuo players uwu !!
105,Yasuo,happy monday friendz I hope everyone has a great week except for yasuo players uwu !!
106,Yasuo,bruh get ur suit out
107,Yasuo,when the /3 yasuo sell all his items for mobi boots + spellbinder cause he got collapsed on in unwarded enemy jun…
108,Yasuo,'s yasuo top is s-tier in itself
109,Yasuo,equality feels like oppression to those who r used to privilege
110,Yasuo,Last time I’m ever sweet on the tl !!!
111,Yasuo,Dalton didn’t even like this until I asked him to feeelsss bad
112,Yasuo,Think of the bronze Yasuo players
113,Yasuo,I accidentally sold my Yasuo (I would've had blademaster) and I beat Blender with this comp O_O
114,Yasuo,Bonus cookie of in game screenshot of the household with their logo as club icons 🤟 man if you can see the struggl…
115,Yasuo,"Yasuo fans come collect yo mans cc: Presenting another custom mesh facemask (modified from the game’s ninja mask),…"
116,Yasuo,Yasuo does not lose to every bruiser in the game
117,Yasuo,What a bop
118,Yasuo,the yasuo costume
119,Yasuo,lmao wow yasuo u dmb fck
120,Yasuo,No cigarettes or vapes
121,Yasuo,so proud of my clash team love u
122,Yasuo,we don't need a riot fighter Seth is fucking Yasuo
123,Yasuo,Nightbringer Yasuo
124,Yasuo,Yasuo is Fair
125,Yasuo,your egirl be callin me smite bc i always be coming too early
126,Yasuo,"Yup. There’s a few characters I’d like to test some things against. LeBlanc, Diana, Nasus, Gragas,…"
127,Yasuo,The sett calls you
128,Yasuo,I can tell u right now ryze really good right now also zed solid that no one bans him no more just yasuo
129,Yasuo,Tell me how the power of dodging games is awful and you need to be punished by ending peoples series ? you too…
130,Yasuo,It literally did tho soo 🤷‍️
131,Yasuo,"Our art museum excited to be gifted a ""dreamlike landscape"" by Yasuo Kuniyoshi, leader of American Modernist m…"
132,Yasuo,Bc I follow and it popped on my tl when he replied sadly
133,Yasuo,It’s just twitter bro lol
134,Yasuo,Yeah I unfollowed u literally Bc u were subtweeting me and I found ur content not necessary on my timeline
135,Yasuo,: How did Moe get Yasuo and Sanchovies got Irelia?? This game staged or other team just doesn't give a fuck?
136,Yasuo,i wish i had a different skin tone so i could rock more hair colors
137,Yasuo,How did Moe get Yasuo and Sanchovies got Irelia?? This game staged or other team just doesn't give a fuck?
138,Yasuo,imagine if yasuo just windwalls my q
139,Yasuo,"You got me feeling like yasuo, 'cause A SERIOOOO???"
140,Yasuo,: creator and actor Mads Mikkelsen dive into the process of bringing the mysterious Cliff t…
141,Yasuo,feel a lot better today tbh some days u just gotta get through n not give up
142,Yasuo,: I was considering not playing TCS. and hit me up last minute and convinced me to play. It is an honor…
143,Yasuo,"Early Mornin' Lego Lemons with Mastery , Yasuo; Tommy!"
144,Yasuo,Fuck a Yasuo
145,Yasuo,: A message from Kayn to Captain Yasuo lmao I’m dumb I’m sorry.
146,Yasuo,NA nightbringer yasuo
147,Yasuo,"I don't think so, but i need a prestige yasuo skin"
148,Yasuo,: I was considering not playing TCS. and hit me up last minute and convinced me to play. It is an honor…
149,Yasuo,: I was considering not playing TCS. and hit me up last minute and convinced me to play. It is an honor…
150,Yasuo,: I was considering not playing TCS. and hit me up last minute and convinced me to play. It is an honor…
151,Yasuo,: I was considering not playing TCS. and hit me up last minute and convinced me to play. It is an honor…
152,Yasuo,: I was considering not playing TCS. and hit me up last minute and convinced me to play. It is an honor…
153,Yasuo,I was considering not playing TCS. and hit me up last minute and convinced me to play. It is a…
154,Yasuo,: A message from Kayn to Captain Yasuo lmao I’m dumb I’m sorry.
155,Yasuo,at least my negative attitude is only towards myself holy sht get off ur high horse
156,Yasuo,im just tweeting my feelings im not looking for validation or help
157,Yasuo,u realise saying shit like that doesnt help right? loooooooool
158,Yasuo,: A message from Kayn to Captain Yasuo lmao I’m dumb I’m sorry.
159,Yasuo,: A message from Kayn to Captain Yasuo lmao I’m dumb I’m sorry.
160,Yasuo,i could post some fk positive bs but actually everything in my life really going downhill lately cant catch a break…
161,Yasuo,ikr my team literally inted
162,Yasuo,Fuck Yasuo players. Especially ones who don't get their role and decide to try and jungle with Yasuo in a ranked game.
163,Yasuo,"ADC has been ""useless"" for a while. That's why people are spamming Heimer, Yasuo, Gragas, veigar in bot"
164,Yasuo,lmao yasuo
165,Yasuo,"""Omg, Aphelios killed me in seconds because I did something wrong"" -Yasuo, Darius, Yi literally…"
166,Yasuo,: The League of Legends boys picked Yasuo and Lucien to pay tribute to and . We will send you some gear. …
167,Yasuo,Yasuo during wind wall
168,Yasuo,Y u gotta bring race into this
169,Yasuo,: So YOU (Rachel) asked this woman to move out of the seat that SHE paid for cuz you ASSUMED she'd want the extra seat be…
170,Yasuo,: The League of Legends boys picked Yasuo and Lucien to pay tribute to and . We will send you some gear. …
171,Yasuo,: The League of Legends boys picked Yasuo and Lucien to pay tribute to and . We will send you some gear. …
172,Yasuo,: The League of Legends boys picked Yasuo and Lucien to pay tribute to and . We will send you some gear. …
173,Yasuo,: The League of Legends boys picked Yasuo and Lucien to pay tribute to and . We will send you some gear. …
174,Yasuo,: The League of Legends boys picked Yasuo and Lucien to pay tribute to and . We will send you some gear. …
175,Yasuo,The League of Legends boys picked Yasuo and Lucien to pay tribute to and . We will send you some g…
176,Yasuo,Im not usually a toxic league player but when you are adamantly refusing to do whats best for the team like hypothe…
177,Yasuo,A message from Kayn to Captain Yasuo lmao I’m dumb I’m sorry.
178,Yasuo,yasuo skin quote lmao
179,Yasuo,I think a lot of problems I see with yasuo players is that they never deviate from the shiv build. Like if you’ve a…
180,Yasuo,": Idk what’s better; Texas sunsets, or my weenie &amp; her chonky lil legs 🥺🥰"
181,Yasuo,: color swap of my faves 🥂 this was fun
182,Yasuo,it was d1 autofilled player on yasuo why didnt u dodge that?
183,Yasuo,We all have comms and are NA
184,Yasuo,Looking for a top laner for clash gold or silver for tonight. Nobody that gets tilted or rages! We made it to the finals
185,Yasuo,": LMAO I love these, here’s my contribution to Full cosplay vs cursed photo htt…"
186,Yasuo,YASUO DOODLE ? CAN ?
187,Yasuo,There will be dedo no cu e gritaria
188,Yasuo,sometimes i wish i could just buck up and sell amber and try to buy a d horse but alas i love her so much and believe in her loool
189,Yasuo,sometiems i get jealous when someone gets a new horse thats fast and made and then i realise how lucky i am to even…
190,Yasuo,"Yasuo mains are the number one for me. Doesn’t matter whether they’re good or bad, one snowball kill and they’re unkillable."
191,Yasuo,: Sett beats yasuo confirmed
192,Yasuo,i prefer less than ft bc im '1
193,Yasuo,I can't
194,Yasuo,Its a sign to play Yasuo!
195,Yasuo,you realize youre not funny right always trying to undermine my serious tweets im so sick of it
196,Yasuo,Lol beat me to it
197,Yasuo,I hate dealing with the bs that comes with being a girl. I wish I was born a man
